{
  "gatewayEui": "ac1f09fffe1c55d3",
  "mqtt": {
    "enabled": true,
    "server": "tcp://127.0.0.1:1883",
    "clientId": "signal-model-test",
    "topicPrefix": "as923",
    "marshaler": "json"
  },
  "lorawan": {
    "enabled": true,
    "joinEnabled": true
  },
  "signalModel": {
    "enabled": true,
    "nodePosition": { "x": 0, "y": 0, "z": 2 },
    "gatewayPosition": { "x": 1000, "y": 0, "z": 30 },
    "environment": "urban",
    "txPower": 16,
    "txGain": 2.15,
    "rxGain": 5.0,
    "cableLoss": 0.5,
    "noiseFloor": -120,
    "shadowFadingStd": 8,
    "fastFadingEnabled": true,
    "timeVariation": true
  },
  "devices": [
    {
      "name": "far-node",
      "lorawan": {
        "activation": "OTAA",
        "devEui": "69AE9F1F00010000",
        "appEui": "0000000000000000",
        "appKey": "00112233445566778899AABBCCDDEEFF",
        "nwkKey": "00112233445566778899AABBCCDDEEFF"
      }
    },
    {
      "name": "mid-node",
      "lorawan": {
        "activation": "OTAA",
        "devEui": "69AE9F1F00020000",
        "appEui": "0000000000000000",
        "appKey": "00112233445566778899AABBCCDDEEFF",
        "nwkKey": "00112233445566778899AABBCCDDEEFF"
      }
    },
    {
      "name": "near-node",
      "lorawan": {
        "activation": "OTAA",
        "devEui": "69AE9F1F00030000",
        "appEui": "0000000000000000",
        "appKey": "00112233445566778899AABBCCDDEEFF",
        "nwkKey": "00112233445566778899AABBCCDDEEFF"
      }
    }
  ],
  "uplink": {
    "enabled": true,
    "intervalMs": 10000
  }
}
