{"gatewayEui":"ac1f09fffe1c55d3","mqtt":{"enabled":true,"server":"tcp://127.0.0.1:1883","clientId":"real-gw-simulator","topicPrefix":"as923","marshaler":"json"},"lorawan":{"enabled":true,"deviceCount":1,"joinEnabled":true},"uplink":{"enabled":true,"intervalMs":5000},"stats":{"enabled":true,"intervalMs":30000}}
