{
  "gatewayEui": "ac1f09fffe1c55d3",
  "mqtt": {
    "enabled": true,
    "server": "tcp://127.0.0.1:1883",
    "clientId": "multi-gateway-handover",
    "topicPrefix": "as923",
    "marshaler": "json"
  },
  "lorawan": {
    "enabled": true,
    "joinEnabled": true
  },
  "signalModel": {
    "enabled": true,
    "gatewayPosition": { "x": 0, "y": 0, "z": 30 },
    "environment": "urban",
    "txPower": 16,
    "txGain": 2.15,
    "rxGain": 5.0,
    "shadowFadingStd": 8
  },
  "multiGateway": {
    "enabled": true,
    "mode": "handover",
    "gateways": [
      {
        "eui": "ac1f09fffe1c55d3",
        "name": "gateway-a",
        "position": { "x": 0, "y": 0, "z": 30 },
        "rxGain": 5.0,
        "rxSensitivity": -137
      },
      {
        "eui": "ac1f09fffe1c55d4",
        "name": "gateway-b",
        "position": { "x": 2000, "y": 0, "z": 25 },
        "rxGain": 5.0,
        "rxSensitivity": -137
      }
    ]
  },
  "devices": [
    {
      "name": "mobile-device-1",
      "description": "移动设备 - 靠近网关A",
      "position": { "x": 300, "y": 0, "z": 2 },
      "lorawan": {
        "activation": "OTAA",
        "devEui": "69AE9F1F00110000",
        "appEui": "0000000000000000",
        "appKey": "00112233445566778899AABBCCDDEEFF",
        "nwkKey": "00112233445566778899AABBCCDDEEFF"
      }
    },
    {
      "name": "mobile-device-2",
      "description": "移动设备 - 中间位置",
      "position": { "x": 1000, "y": 0, "z": 2 },
      "lorawan": {
        "activation": "OTAA",
        "devEui": "69AE9F1F00120000",
        "appEui": "0000000000000000",
        "appKey": "00112233445566778899AABBCCDDEEFF",
        "nwkKey": "00112233445566778899AABBCCDDEEFF"
      }
    },
    {
      "name": "mobile-device-3",
      "description": "移动设备 - 靠近网关B",
      "position": { "x": 1700, "y": 0, "z": 2 },
      "lorawan": {
        "activation": "OTAA",
        "devEui": "69AE9F1F00130000",
        "appEui": "0000000000000000",
        "appKey": "00112233445566778899AABBCCDDEEFF",
        "nwkKey": "00112233445566778899AABBCCDDEEFF"
      }
    }
  ],
  "uplink": {
    "enabled": true,
    "intervalMs": 6000
  }
}
