{
  "gatewayEui": "ac1f09fffe1c55d3",
  "mqtt": {
    "enabled": true,
    "server": "tcp://127.0.0.1:1883",
    "clientId": "multi-gateway-failover",
    "topicPrefix": "as923",
    "marshaler": "json"
  },
  "lorawan": {
    "enabled": true,
    "joinEnabled": true
  },
  "signalModel": {
    "enabled": true,
    "gatewayPosition": { "x": 0, "y": 0, "z": 30 },
    "environment": "urban",
    "txPower": 16,
    "txGain": 2.15,
    "rxGain": 5.0,
    "shadowFadingStd": 8
  },
  "multiGateway": {
    "enabled": true,
    "mode": "failover",
    "primaryGateway": "ac1f09fffe1c55d3",
    "gateways": [
      {
        "eui": "ac1f09fffe1c55d3",
        "name": "primary-gateway",
        "position": { "x": 0, "y": 0, "z": 30 },
        "rxGain": 5.0,
        "rxSensitivity": -137
      },
      {
        "eui": "ac1f09fffe1c55d4",
        "name": "backup-gateway-1",
        "position": { "x": 1000, "y": 500, "z": 20 },
        "rxGain": 4.0,
        "rxSensitivity": -135
      },
      {
        "eui": "ac1f09fffe1c55d5",
        "name": "backup-gateway-2",
        "position": { "x": -500, "y": 800, "z": 15 },
        "rxGain": 3.0,
        "rxSensitivity": -134
      }
    ]
  },
  "devices": [
    {
      "name": "critical-sensor-1",
      "description": "关键传感器1 - 主网关覆盖范围内",
      "position": { "x": 400, "y": 200, "z": 2 },
      "lorawan": {
        "activation": "OTAA",
        "devEui": "69AE9F1F00210000",
        "appEui": "0000000000000000",
        "appKey": "00112233445566778899AABBCCDDEEFF",
        "nwkKey": "00112233445566778899AABBCCDDEEFF"
      }
    },
    {
      "name": "critical-sensor-2",
      "description": "关键传感器2 - 仅在备用网关1覆盖范围",
      "position": { "x": 900, "y": 400, "z": 2 },
      "lorawan": {
        "activation": "OTAA",
        "devEui": "69AE9F1F00220000",
        "appEui": "0000000000000000",
        "appKey": "00112233445566778899AABBCCDDEEFF",
        "nwkKey": "00112233445566778899AABBCCDDEEFF"
      }
    },
    {
      "name": "critical-sensor-3",
      "description": "关键传感器3 - 仅在备用网关2覆盖范围",
      "position": { "x": -400, "y": 700, "z": 2 },
      "lorawan": {
        "activation": "OTAA",
        "devEui": "69AE9F1F00230000",
        "appEui": "0000000000000000",
        "appKey": "00112233445566778899AABBCCDDEEFF",
        "nwkKey": "00112233445566778899AABBCCDDEEFF"
      }
    }
  ],
  "uplink": {
    "enabled": true,
    "intervalMs": 8000
  }
}
