{
  "gatewayEui": "ac1f09fffe1c55d3",
  "mqtt": {
    "enabled": true,
    "server": "tcp://127.0.0.1:1883",
    "clientId": "test-adr-verification",
    "topicPrefix": "as923",
    "marshaler": "json"
  },
  "lorawan": {
    "enabled": true,
    "joinEnabled": true
  },
  "devices": [
    {
      "name": "adr-test-sf12",
      "lorawan": {
        "activation": "OTAA",
        "devEui": "69AE9F1F00010000",
        "appEui": "0000000000000000",
        "appKey": "00112233445566778899AABBCCDDEEFF",
        "nwkKey": "00112233445566778899AABBCCDDEEFF"
      }
    }
  ],
  "uplink": {
    "enabled": true,
    "intervalMs": 3000
  },
  "signalModel": {
    "rssiBase": -50,
    "snrBase": 15,
    "variance": 2
  }
}
