{
  "gatewayEui": "ac1f09fffe1c55d3",
  "mqtt": {
    "enabled": true,
    "server": "tcp://127.0.0.1:1883",
    "clientId": "position-anomaly-test",
    "topicPrefix": "as923",
    "marshaler": "json"
  },
  "lorawan": {
    "enabled": true,
    "joinEnabled": true
  },
  "signalModel": {
    "enabled": true,
    "gatewayPosition": { "x": 0, "y": 0, "z": 30 },
    "environment": "urban",
    "txPower": 16,
    "txGain": 2.15,
    "rxGain": 5.0,
    "shadowFadingStd": 8
  },
  "devices": [
    {
      "name": "near-device",
      "position": { "x": 100, "y": 0, "z": 2 },
      "lorawan": {
        "activation": "OTAA",
        "devEui": "69AE9F1F00010000",
        "appEui": "0000000000000000",
        "appKey": "00112233445566778899AABBCCDDEEFF",
        "nwkKey": "00112233445566778899AABBCCDDEEFF"
      }
    },
    {
      "name": "mid-device",
      "position": { "x": 800, "y": 200, "z": 2 },
      "lorawan": {
        "activation": "OTAA",
        "devEui": "69AE9F1F00020000",
        "appEui": "0000000000000000",
        "appKey": "00112233445566778899AABBCCDDEEFF",
        "nwkKey": "00112233445566778899AABBCCDDEEFF"
      }
    },
    {
      "name": "far-device",
      "position": { "x": 2000, "y": 500, "z": 2 },
      "lorawan": {
        "activation": "OTAA",
        "devEui": "69AE9F1F00030000",
        "appEui": "0000000000000000",
        "appKey": "00112233445566778899AABBCCDDEEFF",
        "nwkKey": "00112233445566778899AABBCCDDEEFF"
      }
    },
    {
      "name": "anomaly-fcnt-dup",
      "position": { "x": 500, "y": 0, "z": 2 },
      "lorawan": {
        "activation": "OTAA",
        "devEui": "69AE9F1F00040000",
        "appEui": "0000000000000000",
        "appKey": "00112233445566778899AABBCCDDEEFF",
        "nwkKey": "00112233445566778899AABBCCDDEEFF"
      },
      "anomaly": {
        "enabled": true,
        "scenario": "fcnt-duplicate",
        "trigger": "every-3rd-uplink",
        "params": {}
      }
    },
    {
      "name": "anomaly-mic-error",
      "position": { "x": 600, "y": 0, "z": 2 },
      "lorawan": {
        "activation": "OTAA",
        "devEui": "69AE9F1F00050000",
        "appEui": "0000000000000000",
        "appKey": "00112233445566778899AABBCCDDEEFF",
        "nwkKey": "00112233445566778899AABBCCDDEEFF"
      },
      "anomaly": {
        "enabled": true,
        "scenario": "mic-corrupt",
        "trigger": "random-10-percent",
        "params": { "flipBits": 2 }
      }
    },
    {
      "name": "anomaly-weak-signal",
      "position": { "x": 700, "y": 0, "z": 2 },
      "lorawan": {
        "activation": "OTAA",
        "devEui": "69AE9F1F00060000",
        "appEui": "0000000000000000",
        "appKey": "00112233445566778899AABBCCDDEEFF",
        "nwkKey": "00112233445566778899AABBCCDDEEFF"
      },
      "anomaly": {
        "enabled": true,
        "scenario": "signal-weak",
        "trigger": "always",
        "params": { "rssi": -145, "snr": -25 }
      }
    }
  ],
  "uplink": {
    "enabled": true,
    "intervalMs": 8000
  }
}
