{
  "gatewayEui": "ac1f09fffe1c55d3",
  "mqtt": {
    "enabled": true,
    "server": "tcp://127.0.0.1:1883",
    "clientId": "30nodes-random-test",
    "mqttTopicPrefix": "as923",
    "marshaler": "json"
  },
  "lorawan": {
    "enabled": true,
    "joinEnabled": true
  },
  "signalModel": {
    "enabled": true,
    "gatewayPosition": { "x": 0, "y": 0, "z": 30 },
    "environment": "urban",
    "txPower": 16,
    "txGain": 2.15,
    "rxGain": 5.0,
    "shadowFadingStd": 8,
    "fastFadingEnabled": true
  },
  "multiGateway": {
    "enabled": true,
    "mode": "overlapping",
    "gateways": [
      {
        "eui": "ac1f09fffe1c55d3",
        "name": "gateway-center",
        "position": { "x": 0, "y": 0, "z": 30 },
        "rxGain": 5.0,
        "rxSensitivity": -137
      },
      {
        "eui": "ac1f09fffe1c55d4",
        "name": "gateway-east",
        "position": { "x": 2000, "y": 0, "z": 20 },
        "rxGain": 4.5,
        "rxSensitivity": -135
      },
      {
        "eui": "ac1f09fffe1c55d5",
        "name": "gateway-south",
        "position": { "x": 0, "y": -1500, "z": 15 },
        "rxGain": 4.0,
        "rxSensitivity": -134
      }
    ]
  },
  "devices": [
    {"name": "node-01", "position": { "x": 245, "y": -892, "z": 2 }, "lorawan": {"activation": "OTAA", "devEui": "69AE9F1F00010000", "appEui": "0000000000000000", "appKey": "00112233445566778899AABBCCDDEEFF", "nwkKey": "00112233445566778899AABBCCDDEEFF"}},
    {"name": "node-02", "position": { "x": 1567, "y": 234, "z": 2 }, "lorawan": {"activation": "OTAA", "devEui": "69AE9F1F00020000", "appEui": "0000000000000000", "appKey": "00112233445566778899AABBCCDDEEFF", "nwkKey": "00112233445566778899AABBCCDDEEFF"}},
    {"name": "node-03", "position": { "x": -456, "y": 1234, "z": 2 }, "lorawan": {"activation": "OTAA", "devEui": "69AE9F1F00030000", "appEui": "0000000000000000", "appKey": "00112233445566778899AABBCCDDEEFF", "nwkKey": "00112233445566778899AABBCCDDEEFF"}},
    {"name": "node-04", "position": { "x": 1890, "y": -567, "z": 2 }, "lorawan": {"activation": "OTAA", "devEui": "69AE9F1F00040000", "appEui": "0000000000000000", "appKey": "00112233445566778899AABBCCDDEEFF", "nwkKey": "00112233445566778899AABBCCDDEEFF"}},
    {"name": "node-05", "position": { "x": -1234, "y": -890, "z": 2 }, "lorawan": {"activation": "OTAA", "devEui": "69AE9F1F00050000", "appEui": "0000000000000000", "appKey": "00112233445566778899AABBCCDDEEFF", "nwkKey": "00112233445566778899AABBCCDDEEFF"}},
    {"name": "node-06", "position": { "x": 678, "y": 1456, "z": 2 }, "lorawan": {"activation": "OTAA", "devEui": "69AE9F1F00060000", "appEui": "0000000000000000", "appKey": "00112233445566778899AABBCCDDEEFF", "nwkKey": "00112233445566778899AABBCCDDEEFF"}},
    {"name": "node-07", "position": { "x": -890, "y": 345, "z": 2 }, "lorawan": {"activation": "OTAA", "devEui": "69AE9F1F00070000", "appEui": "0000000000000000", "appKey": "00112233445566778899AABBCCDDEEFF", "nwkKey": "00112233445566778899AABBCCDDEEFF"}},
    {"name": "node-08", "position": { "x": 2345, "y": 678, "z": 2 }, "lorawan": {"activation": "OTAA", "devEui": "69AE9F1F00080000", "appEui": "0000000000000000", "appKey": "00112233445566778899AABBCCDDEEFF", "nwkKey": "00112233445566778899AABBCCDDEEFF"}},
    {"name": "node-09", "position": { "x": -567, "y": -1234, "z": 2 }, "lorawan": {"activation": "OTAA", "devEui": "69AE9F1F00090000", "appEui": "0000000000000000", "appKey": "00112233445566778899AABBCCDDEEFF", "nwkKey": "00112233445566778899AABBCCDDEEFF"}},
    {"name": "node-10", "position": { "x": 1234, "y": -456, "z": 2 }, "lorawan": {"activation": "OTAA", "devEui": "69AE9F1F000A0000", "appEui": "0000000000000000", "appKey": "00112233445566778899AABBCCDDEEFF", "nwkKey": "00112233445566778899AABBCCDDEEFF"}},
    {"name": "node-11", "position": { "x": 89, "y": 1567, "z": 2 }, "lorawan": {"activation": "OTAA", "devEui": "69AE9F1F000B0000", "appEui": "0000000000000000", "appKey": "00112233445566778899AABBCCDDEEFF", "nwkKey": "00112233445566778899AABBCCDDEEFF"}},
    {"name": "node-12", "position": { "x": -1456, "y": 789, "z": 2 }, "lorawan": {"activation": "OTAA", "devEui": "69AE9F1F000C0000", "appEui": "0000000000000000", "appKey": "00112233445566778899AABBCCDDEEFF", "nwkKey": "00112233445566778899AABBCCDDEEFF"}},
    {"name": "node-13", "position": { "x": 2100, "y": -1200, "z": 2 }, "lorawan": {"activation": "OTAA", "devEui": "69AE9F1F000D0000", "appEui": "0000000000000000", "appKey": "00112233445566778899AABBCCDDEEFF", "nwkKey": "00112233445566778899AABBCCDDEEFF"}},
    {"name": "node-14", "position": { "x": -789, "y": 2100, "z": 2 }, "lorawan": {"activation": "OTAA", "devEui": "69AE9F1F000E0000", "appEui": "0000000000000000", "appKey": "00112233445566778899AABBCCDDEEFF", "nwkKey": "00112233445566778899AABBCCDDEEFF"}},
    {"name": "node-15", "position": { "x": 1567, "y": 1567, "z": 2 }, "lorawan": {"activation": "OTAA", "devEui": "69AE9F1F000F0000", "appEui": "0000000000000000", "appKey": "00112233445566778899AABBCCDDEEFF", "nwkKey": "00112233445566778899AABBCCDDEEFF"}},
    {"name": "node-16", "position": { "x": -2100, "y": -300, "z": 2 }, "lorawan": {"activation": "OTAA", "devEui": "69AE9F1F00100000", "appEui": "0000000000000000", "appKey": "00112233445566778899AABBCCDDEEFF", "nwkKey": "00112233445566778899AABBCCDDEEFF"}},
    {"name": "node-17", "position": { "x": 345, "y": -1800, "z": 2 }, "lorawan": {"activation": "OTAA", "devEui": "69AE9F1F00110000", "appEui": "0000000000000000", "appKey": "00112233445566778899AABBCCDDEEFF", "nwkKey": "00112233445566778899AABBCCDDEEFF"}},
    {"name": "node-18", "position": { "x": 1800, "y": 890, "z": 2 }, "lorawan": {"activation": "OTAA", "devEui": "69AE9F1F00120000", "appEui": "0000000000000000", "appKey": "00112233445566778899AABBCCDDEEFF", "nwkKey": "00112233445566778899AABBCCDDEEFF"}},
    {"name": "node-19", "position": { "x": -1200, "y": 1200, "z": 2 }, "lorawan": {"activation": "OTAA", "devEui": "69AE9F1F00130000", "appEui": "0000000000000000", "appKey": "00112233445566778899AABBCCDDEEFF", "nwkKey": "00112233445566778899AABBCCDDEEFF"}},
    {"name": "node-20", "position": { "x": 2678, "y": -890, "z": 2 }, "lorawan": {"activation": "OTAA", "devEui": "69AE9F1F00140000", "appEui": "0000000000000000", "appKey": "00112233445566778899AABBCCDDEEFF", "nwkKey": "00112233445566778899AABBCCDDEEFF"}},
    {"name": "node-21", "position": { "x": -456, "y": -1678, "z": 2 }, "lorawan": {"activation": "OTAA", "devEui": "69AE9F1F00150000", "appEui": "0000000000000000", "appKey": "00112233445566778899AABBCCDDEEFF", "nwkKey": "00112233445566778899AABBCCDDEEFF"}},
    {"name": "node-22", "position": { "x": 1456, "y": 234, "z": 2 }, "lorawan": {"activation": "OTAA", "devEui": "69AE9F1F00160000", "appEui": "0000000000000000", "appKey": "00112233445566778899AABBCCDDEEFF", "nwkKey": "00112233445566778899AABBCCDDEEFF"}},
    {"name": "node-23", "position": { "x": -2345, "y": 567, "z": 2 }, "lorawan": {"activation": "OTAA", "devEui": "69AE9F1F00170000", "appEui": "0000000000000000", "appKey": "00112233445566778899AABBCCDDEEFF", "nwkKey": "00112233445566778899AABBCCDDEEFF"}},
    {"name": "node-24", "position": { "x": 567, "y": 2100, "z": 2 }, "lorawan": {"activation": "OTAA", "devEui": "69AE9F1F00180000", "appEui": "0000000000000000", "appKey": "00112233445566778899AABBCCDDEEFF", "nwkKey": "00112233445566778899AABBCCDDEEFF"}},
    {"name": "node-25", "position": { "x": -1800, "y": -1456, "z": 2 }, "lorawan": {"activation": "OTAA", "devEui": "69AE9F1F00190000", "appEui": "0000000000000000", "appKey": "00112233445566778899AABBCCDDEEFF", "nwkKey": "00112233445566778899AABBCCDDEEFF"}},
    {"name": "node-26", "position": { "x": 234, "y": 2678, "z": 2 }, "lorawan": {"activation": "OTAA", "devEui": "69AE9F1F001A0000", "appEui": "0000000000000000", "appKey": "00112233445566778899AABBCCDDEEFF", "nwkKey": "00112233445566778899AABBCCDDEEFF"}},
    {"name": "node-27", "position": { "x": 3000, "y": 1234, "z": 2 }, "lorawan": {"activation": "OTAA", "devEui": "69AE9F1F001B0000", "appEui": "0000000000000000", "appKey": "00112233445566778899AABBCCDDEEFF", "nwkKey": "00112233445566778899AABBCCDDEEFF"}},
    {"name": "node-28", "position": { "x": -1234, "y": 2345, "z": 2 }, "lorawan": {"activation": "OTAA", "devEui": "69AE9F1F001C0000", "appEui": "0000000000000000", "appKey": "00112233445566778899AABBCCDDEEFF", "nwkKey": "00112233445566778899AABBCCDDEEFF"}},
    {"name": "node-29", "position": { "x": 1890, "y": -2100, "z": 2 }, "lorawan": {"activation": "OTAA", "devEui": "69AE9F1F001D0000", "appEui": "0000000000000000", "appKey": "00112233445566778899AABBCCDDEEFF", "nwkKey": "00112233445566778899AABBCCDDEEFF"}},
    {"name": "node-30", "position": { "x": -2678, "y": -1234, "z": 2 }, "lorawan": {"activation": "OTAA", "devEui": "69AE9F1F001E0000", "appEui": "0000000000000000", "appKey": "00112233445566778899AABBCCDDEEFF", "nwkKey": "00112233445566778899AABBCCDDEEFF"}}
  ],
  "uplink": {
    "enabled": true,
    "intervalMs": 3000
  }
}
